State,Bill_ID,Title,Status,Category,Year,Session,Updated,URL,Last_Checked
California,AB 2653,State contracts: certification process: Sweatfree AI Code of Conduct.,Introduced,General AI,2026,20252026,2026-04-10T08:30:48.481915+00:00,,2026-04-13 10:53:38
California,SB 1000,California AI Transparency Act.,Introduced,Transparency,2026,20252026,2026-04-11T09:15:30.644328+00:00,,2026-04-13 10:53:38
California,SB 1011,"Energy: Utility Infrastructure AI Safety, Oversight, and Workforce Protection Act.",Introduced,Safety/Liability,2026,20252026,2026-04-11T09:16:37.081144+00:00,,2026-04-13 10:53:38
California,SB 1119,Companion chatbots: children's safety.,Introduced,Chatbots; Education/Child Protection; Safety/Liability,2026,20252026,2026-04-10T08:57:34.099737+00:00,,2026-04-13 10:53:38
California,SB 1146,Advertisement claims: health-related consumer products and services: artificial intelligence.,Introduced,Healthcare,2026,20252026,2026-04-13T09:18:03.409846+00:00,,2026-04-13 10:53:38
California,SB 867,Toys: companion chatbots.,Introduced,Chatbots,2026,20252026,2026-04-11T08:52:59.793208+00:00,,2026-04-13 10:53:38
California,SB 903,Mental health professionals: artificial intelligence.,Introduced,Healthcare,2026,20252026,2026-04-11T08:51:21.576794+00:00,,2026-04-13 10:53:38
Colorado,HB 1139,Use of Artificial Intelligence in Health Care,Introduced,Healthcare,2026,2026A,2026-04-06T21:33:17.153188+00:00,,2026-04-13 10:53:38
Connecticut,HB 5342,AN ACT CONCERNING THE USE OF ARTIFICIAL INTELLIGENCE AND OTHER MEANS TO GENERATE DECEPTIVE SYNTHETIC MEDIA AND AFFECT ELECTIONS.,Introduced,Elections,2026,2026,2026-04-11T01:23:55.810652+00:00,,2026-04-13 10:53:38
Connecticut,SB 435,AN ACT CONCERNING AUTOMATED DECISION SYSTEMS PROTECTIONS FOR EMPLOYEES.,Introduced,Employment,2026,2026,2026-04-11T01:31:05.575000+00:00,,2026-04-13 10:53:38
Florida,HB 1395,Artificial Intelligence,Introduced,General AI,2026,2026,2026-03-18T19:34:00.096660+00:00,,2026-04-13 10:53:38
Georgia,HB 1603,Georgia Entertainment Artificial Intelligence Accountability and Performer Protection Act; enact,Introduced,General AI,2026,2025_26,2026-04-01T09:59:26.357611+00:00,,2026-04-13 10:53:38
Georgia,SB 444,Private Review Agents; certain decisions with regard to the provision of insurance coverage for healthcare services shall not be based solely on artificial intelligence systems; provide,Introduced,Healthcare; Financial Services,2026,2025_26,2026-04-11T10:08:33.726962+00:00,,2026-04-13 10:53:38
Georgia,SB 540,Online Internet Safety; certain disclosures related to conversational AI services; require,Introduced,Transparency; Chatbots; Safety/Liability,2026,2025_26,2026-04-11T10:11:30.988761+00:00,,2026-04-13 10:53:38
Idaho,H 945,ARTIFICIAL INTELLIGENCE MEDICAL SERVICES – Adds to existing law to establish provisions regarding artifical intelligence medical services.,Introduced,Healthcare,2026,2026,2026-03-26T00:41:32.749775+00:00,,2026-04-13 10:53:38
Illinois,HB 4804,REGISTERED NURSE USE OF AI,Introduced,General AI,2026,104th,2026-03-28T08:48:23.192378+00:00,,2026-04-13 10:53:38
Illinois,HB 4980,HUMAN CONTROL OF AI ACT,Introduced,General AI,2026,104th,2026-04-11T08:06:50.664278+00:00,,2026-04-13 10:53:38
Illinois,HB 5106,CRIM CD-DEEPFAKE-HARASS,Introduced,Elections,2026,104th,2026-03-18T14:57:27.845874+00:00,,2026-04-13 10:53:38
Illinois,SB 3262,COMPANION AI PROTECTION ACT,Introduced,General AI,2026,104th,2026-04-11T08:24:49.472998+00:00,,2026-04-13 10:53:38
Illinois,SB 3263,AI PROVENANCE DATA ACT,Introduced,General AI,2026,104th,2026-04-11T09:08:18.504306+00:00,,2026-04-13 10:53:38
Illinois,SB 3312,AI SAFETY MEASURES ACT,Introduced,Safety/Liability,2026,104th,2026-04-11T08:28:48.758716+00:00,,2026-04-13 10:53:38
Illinois,SB 3384,AI COMPANION MODEL SAFETY ACT,Introduced,Safety/Liability,2026,104th,2026-04-11T08:51:48.863060+00:00,,2026-04-13 10:53:38
Illinois,SB 3702,REGISTERED NURSE USE OF AI,Introduced,General AI,2026,104th,2026-03-28T09:01:51.344146+00:00,,2026-04-13 10:53:38
Iowa,HSB 766,"A bill for an act relating to the licensure of artificial intelligence augmented and autonomous service providers, and including penalties.",Introduced,General AI,2026,2025-2026,2026-03-24T21:49:08.843399+00:00,,2026-04-13 10:53:38
Louisiana,HB 1149,CURRICULA: Requires each public school to incorporate instruction on artificial intelligence into an existing course of study for each student in grades six through twelve (OR NO IMPACT   See Note),Introduced,Government Use; Education/Child Protection,2026,2026,2026-04-12T16:54:42.266394+00:00,,2026-04-13 10:53:38
Louisiana,HB 1184,PUBLIC CONTRACTS: Prohibits public contracts with entities owned or controlled by foreign adversaries for the provision of artificial intelligence technology (OR NO IMPACT   See Note),Introduced,Government Use,2026,2026,2026-04-12T16:58:05.912446+00:00,,2026-04-13 10:53:38
Louisiana,HB 734,COMMERCE: Creates a consumer bill of rights regarding artificial intelligence,Introduced,General AI,2026,2026,2026-04-02T16:57:13.547023+00:00,,2026-04-13 10:53:38
Louisiana,HB 791,"COMMERCIAL REGULATIONS: Provides relative to the regulation of artificial intelligence (OR +$256,243 GF EX See Note)",Introduced,General AI,2026,2026,2026-04-12T23:27:55.868934+00:00,,2026-04-13 10:53:38
Louisiana,HB 872,FISHING/COMMERCIAL: Requires all commercial menhaden reduction fishery vessels to use an AIS system,Introduced,General AI,2026,2026,2026-04-10T01:57:23.240484+00:00,,2026-04-13 10:53:38
Louisiana,HB 880,"INSURANCE: Creates the Louisiana Artificial Intelligence Insurance Fairness Act (OR +$1,029,533 SG EX See Note)",Introduced,Bias/Discrimination; Financial Services,2026,2026,2026-04-09T16:21:42.887310+00:00,,2026-04-13 10:53:38
Louisiana,SB 346,SCHOOLS: Prohibits the use of deepfake material against students enrolled in K-12. (8/1/26),Introduced,Elections; Education/Child Protection,2026,2026,2026-04-02T17:09:23.323988+00:00,,2026-04-13 10:53:38
Louisiana,SB 347,"COLLEGES/UNIVERSITIES: Provides for the crime of ""unlawful deepfake"" to be added to the definition of power-based violence under the Campus Accountability and Safety Act. (gov sig)",Introduced,Elections; Safety/Liability,2026,2026,2026-04-02T17:02:08.139767+00:00,,2026-04-13 10:53:38
Maine,LD 2162,An Act To Regulate And Prevent Children'S Access To Artificial Intelligence Chatbots With Human-Like Features And Social Artificial Intelligence Companions,Introduced,Chatbots; Education/Child Protection,2026,132,2026-04-09T07:34:19.658204+00:00,,2026-04-13 10:53:38
Maryland,HB 1057,"Education - Artificial Intelligence - Guidelines, Professional Development, and Collaborative (Artificial Intelligence Ready Schools Act)",Introduced,Employment; Education/Child Protection,2026,2026,2026-04-11T19:37:57.989830+00:00,,2026-04-13 10:53:38
Maryland,HB 145,"Election Law - Election Misinformation, Election Disinformation, and Deepfakes",Introduced,Elections,2026,2026,2026-04-11T01:47:42.571929+00:00,,2026-04-13 10:53:38
Maryland,SB 141,"Election Law - Election Misinformation, Election Disinformation, and Deepfakes",Introduced,Elections,2026,2026,2026-04-10T21:45:05.044195+00:00,,2026-04-13 10:53:38
Maryland,SB 597,Higher Education - Maryland Artificial Intelligence Partnership,Introduced,Education/Child Protection,2026,2026,2026-04-11T23:50:54.194249+00:00,,2026-04-13 10:53:38
Maryland,SB 720,"Education - Artificial Intelligence - Guidelines, Professional Development, and Collaborative (Artificial Intelligence Ready Schools Act)",Introduced,Employment; Education/Child Protection,2026,2026,2026-04-11T17:50:12.175615+00:00,,2026-04-13 10:53:38
Maryland,SB 8,Criminal Law - Identity Fraud - Artificial Intelligence and Deepfake Representations,Introduced,Elections; Criminal Justice,2026,2026,2026-04-11T01:55:09.496909+00:00,,2026-04-13 10:53:38
Minnesota,HF 3893,"Use of artificial intelligence in psychotherapy services regulated, and civil penalties provided.",Introduced,General AI,2026,2025-2026,2026-04-09T22:02:34.612967+00:00,,2026-04-13 10:53:38
Minnesota,HF 4452,"Artificial intelligence chatbot technology requirements provided, and cause of action for harm created.",Introduced,Chatbots; Safety/Liability,2026,2025-2026,2026-04-06T21:06:09.579598+00:00,,2026-04-13 10:53:38
Minnesota,SF 4997,Artificial intelligence chatbot technology requirements provision,Introduced,Chatbots,2026,2025-2026,2026-04-08T21:55:07.493456+00:00,,2026-04-13 10:53:38
New Hampshire,SB 657,creating a study commission to oversee the use of artificial intelligence in the state.,Introduced,General AI,2026,2026,2026-04-12T17:07:55.755422+00:00,,2026-04-13 10:53:38
New Mexico,HB 22,DISTRIBUTION OF SENSITIVE AND DEEPFAKE IMAGES,Introduced,Elections,2026,2026,2026-03-26T18:06:42.616699+00:00,,2026-04-13 10:53:38
New York,A 10379,Prohibits artificial intelligence chatbots from using features which are considered unsafe for minors,Introduced,Chatbots; Education/Child Protection,2026,2025-2026,2026-04-07T01:41:51.704438+00:00,,2026-04-13 10:53:38
Oklahoma,HB 3545,Technology; artificial intelligence; state agencies; prohibited uses; permitted uses; Office of Management and Enterprise Services; effective date.,Introduced,General AI,2026,2026,2026-04-01T23:50:50.407218+00:00,,2026-04-13 10:53:38
Oklahoma,SB 1521,Artificial intelligence; prohibiting the creation of certain artificial intelligence chatbots; requiring certain age verification measures and protections for user data. Effective date.,Introduced,Chatbots,2026,2026,2026-04-09T16:00:07.965086+00:00,,2026-04-13 10:53:38
Rhode Island,HB 7538,AN ACT RELATING TO HEALTH AND SAFETY -- USE OF ARTIFICIAL INTELLIGENCE BY HEALTHCARE PROVIDERS NOTIFICATION ACT,Introduced,Healthcare; Safety/Liability,2026,2026,2026-04-10T22:54:36.221580+00:00,,2026-04-13 10:53:38
Rhode Island,HB 7767,AN ACT RELATING TO LABOR AND LABOR RELATIONS -- ARTIFICIAL INTELLIGENCE USE AND FAIR EMPLOYMENT PRACTICES,Introduced,Employment,2026,2026,2026-04-10T20:45:26.835915+00:00,,2026-04-13 10:53:38
Rhode Island,SB 2499,AN ACT RELATING TO LABOR AND LABOR RELATIONS -- ARTIFICIAL INTELLIGENCE USE AND FAIR EMPLOYMENT PRACTICES,Introduced,Employment,2026,2026,2026-04-09T14:58:24.105579+00:00,,2026-04-13 10:53:38
South Carolina,H 5476,Protecting Children from Chatbots,Introduced,Chatbots; Education/Child Protection,2026,2025-2026,2026-04-01T07:24:51.921558+00:00,,2026-04-13 10:53:38
Tennessee,HB 1513,"Election Laws - As enacted, requires political advertisements to include a disclaimer if the advertisements include deepfake elements impersonating or depicting a candidate engaging in activity or speech in which the impersonated or depicted candidate did not in fact engage; makes a violation of such disclaimer requirement a Class C misdemeanor; entitles candidate to damages and equitable relief for violations. - Amends TCA Title 2, Chapter 19.",Introduced,Elections,2026,114,2026-04-01T03:05:36.044448+00:00,,2026-04-13 10:53:38
Tennessee,HB 1898,"Safety - As introduced, enacts the ""Artificial Intelligence Public Safety and Child Protection Transparency Act."" - Amends TCA Title 4; Title 10, Chapter 7; Title 47; Title 58 and Title 68.",Introduced,Transparency; Government Use; Education/Child Protection; Safety/Liability,2026,114,2026-04-10T21:16:49.006374+00:00,,2026-04-13 10:53:38
Tennessee,HB 1946,"Consumer Protection - As introduced, enacts the ""Curbing Harmful AI Technology (CHAT) Act."" - Amends TCA Title 29; Title 37 and Title 47.",Introduced,Safety/Liability,2026,114,2026-04-09T03:39:47.112648+00:00,,2026-04-13 10:53:38
Tennessee,SB 1624,"Election Laws - As enacted, requires political advertisements to include a disclaimer if the advertisements include deepfake elements impersonating or depicting a candidate engaging in activity or speech in which the impersonated or depicted candidate did not in fact engage; makes a violation of such disclaimer requirement a Class C misdemeanor; entitles candidate to damages and equitable relief for violations. - Amends TCA Title 2, Chapter 19.",Introduced,Elections,2026,114,2026-04-01T09:21:36.099378+00:00,,2026-04-13 10:53:38
Tennessee,SB 1700,"Consumer Protection - As introduced, enacts the ""Curbing Harmful AI Technology (CHAT) Act."" - Amends TCA Title 29; Title 37 and Title 47.",Introduced,Safety/Liability,2026,114,2026-04-11T03:36:22.511342+00:00,,2026-04-13 10:53:38
Tennessee,SB 2171,"Safety - As introduced, enacts the ""Artificial Intelligence Public Safety and Child Protection Transparency Act."" - Amends TCA Title 4; Title 10, Chapter 7; Title 47; Title 58 and Title 68.",Introduced,Transparency; Government Use; Education/Child Protection; Safety/Liability,2026,114,2026-04-11T03:45:56.322647+00:00,,2026-04-13 10:53:38
Utah,HB 276,Artificial Intelligence Modifications,Introduced,General AI,2026,2026,2026-03-26T01:36:04.640871+00:00,,2026-04-13 10:53:38
Washington,HB 2225,Concerning regulation of artificial intelligence companion chatbots.,Introduced,Chatbots,2026,2025-2026,2026-03-28T02:35:00.324351+00:00,,2026-04-13 10:53:38
Washington,SB 5984,Concerning regulation of artificial intelligence companion chatbots.,Introduced,Chatbots,2026,2025-2026,2026-03-28T02:22:26.840346+00:00,,2026-04-13 10:53:38
Florida,SB 482,Artificial Intelligence Bill of Rights,Introduced,General AI,2025,2026,2026-03-20T23:11:12.501911+00:00,,2026-04-13 10:53:38
Illinois,HB 3529,AI PRINCIPLES,Introduced,General AI,2025,104th,2026-03-18T15:49:37.817358+00:00,,2026-04-13 10:53:38
Illinois,HB 4248,ALGORITHMIC PRICE TRANSPARENCY,Introduced,Transparency,2025,104th,2026-04-11T07:41:59.515455+00:00,,2026-04-13 10:53:38
Michigan,SB 760,Trade: business regulation; availability of companion chatbots to minors; prohibit. Creates new act.,Introduced,Chatbots; Education/Child Protection,2025,2025-2026,2026-04-09T22:18:52.725340+00:00,,2026-04-13 10:53:38
Minnesota,SF 1857,Minor access to chatbots for conversational purposes by persons prohibition provision,Introduced,Chatbots; Education/Child Protection,2025,2025-2026,2026-04-07T19:03:56.250294+00:00,,2026-04-13 10:53:38
Missouri,HB 2032,Establishes age verification measures for companion chatbots,Introduced,Chatbots,2025,2026,2026-04-07T20:01:51.223613+00:00,,2026-04-13 10:53:38
Missouri,SB 1183,"SB 1183 - Under the act, a creator, as defined in the act, shall not, within 18 weeks of an election, distribute a synthetic media message that the creator knows or should have known is a deceptive and fraudulent deepfake, as defined in the act. These provisions shall not apply if the creator of the audio or visual media includes a certain disclosure statement, as described in the act.

	A candidate whose appearance, action, or speech is depicted through the use of a deceptive and fraudulent deepfake may seek injunctive or other equitable relief from the creator prohibiting the publication of such deceptive and fraudulent deepfake.

	A person in violation of provisions under the act may be subject to certain criminal and civil penalties, as described in the act.

	The act shall not apply to certain exceptions and media as described in the act.

	The act is similar to a provision in SCS/HCS/HBs 2628 & 2603 (2024).
JULIA SHEVELEVA",Introduced,Elections; Transparency; Government Use; Criminal Justice,2025,2026,2026-03-23T19:58:43.178633+00:00,,2026-04-13 10:53:38
Montana,SB 212,Creating the Right to Compute Act and requiring shutdowns of AI controlled critical infrastructure,Introduced,General AI,2025,2025,2026-03-18T12:33:34.204892+00:00,,2026-04-13 10:53:38
Montana,SB 413,Criminalize disclosure of certain explicit AI-generated media,Introduced,Transparency; Criminal Justice,2025,2025,2026-03-18T12:25:07.544103+00:00,,2026-04-13 10:53:38
New Hampshire,HB 1406,"relative to health carrier recordkeeping requirements in utilization review, including specifications regarding the use of artificial intelligence.",Introduced,Healthcare,2025,2026,2026-04-12T17:01:43.159320+00:00,,2026-04-13 10:53:38
New Hampshire,HB 1506,creating an exception to the restricted uses of artificial intelligence by state agencies.,Introduced,General AI,2025,2026,2026-04-11T17:08:06.811254+00:00,,2026-04-13 10:53:38
New Hampshire,HB 1612,"relative to the use of price-fixing websites, algorithms, or other software by landlords.",Introduced,General AI,2025,2026,2026-04-12T17:06:56.745016+00:00,,2026-04-13 10:53:38
New Hampshire,SB 640,relative to the use of artificial intelligence to provide services requiring a professional license.,Introduced,General AI,2025,2026,2026-04-12T17:06:24.112674+00:00,,2026-04-13 10:53:38
New York,A 222,"Relates to liability for misleading, incorrect, contradictory or harmful information provided to a user by a chatbot",Introduced,Chatbots; Safety/Liability,2025,2025-2026,2026-03-18T11:19:00.639207+00:00,,2026-04-13 10:53:38
New York,A 8595,"Enacts the ""New York artificial intelligence transparency for journalism act""",Introduced,Transparency,2025,2025-2026,2026-03-18T10:59:51.003028+00:00,,2026-04-13 10:53:38
New York,A 8962,Enacts the New York fundamental artificial intelligence requirements in (FAIR) news act,Introduced,General AI,2025,2025-2026,2026-04-07T02:20:10.648246+00:00,,2026-04-13 10:53:38
New York,S 5668,"Relates to liability for misleading, incorrect, contradictory or harmful information provided to a user by a chatbot",Introduced,Chatbots; Safety/Liability,2025,2025-2026,2026-03-18T11:26:52.855403+00:00,,2026-04-13 10:53:38
New York,S 8331,"Enacts the ""New York artificial intelligence transparency for journalism act""",Introduced,Transparency,2025,2025-2026,2026-03-18T11:30:10.881454+00:00,,2026-04-13 10:53:38
Tennessee,HB 1455,"Criminal Offenses - As introduced, creates a Class A felony offense of knowingly training artificial intelligence to encourage the act of suicide or criminal homicide, or act in specific manners, including developing an emotional relationship with an individual or simulating a human being, including in appearance, voice, or other mannerisms. - Amends TCA Title 29; Title 33; Title 39 and Title 47.",Introduced,Criminal Justice,2025,114,2026-04-09T03:15:35.470851+00:00,,2026-04-13 10:53:38
Tennessee,SB 837,"Statutes and Codification - As introduced, defines ""human being,"" ""life,"" and ""natural person"" for statutory construction purposes; excludes from the definition of ""person,"" ""life,"" and ""natural person"" artificial intelligence, a computer algorithm, a software program, computer hardware, or any type of machine. - Amends TCA Title 1.",Introduced,General AI,2025,114,2026-04-10T21:39:06.335602+00:00,,2026-04-13 10:53:38
