State,Bill_ID,Title,Status,Category,Year,Session,Updated,URL,Last_Checked
California,AB 1609,Customer service chatbots.,Introduced,Chatbots,2026,20252026,2026-05-21T08:53:31.694806+00:00,,2026-05-21 12:21:32
California,AB 1979,Health care services: artificial intelligence.,Introduced,Healthcare,2026,20252026,2026-05-21T08:54:52.218075+00:00,,2026-05-21 12:21:32
California,AB 1988,Companion chatbots: crisis interruption pauses.,Introduced,Chatbots,2026,20252026,2026-05-21T08:49:07.374651+00:00,,2026-05-21 12:21:32
California,AB 2023,Companion chatbots: children's safety.,Introduced,Chatbots; Education/Child Protection; Safety/Liability,2026,20252026,2026-05-21T08:48:23.912819+00:00,,2026-05-21 12:21:32
California,AB 2392,Public postsecondary education: generative artificial intelligence systems: procurement standards: training.,Introduced,Government Use; Education/Child Protection,2026,20252026,2026-05-21T08:50:44.292883+00:00,,2026-05-21 12:21:32
California,AB 2504,Community colleges: artificial intelligence: pilot program.,Introduced,General AI,2026,20252026,2026-05-21T08:51:38.071336+00:00,,2026-05-21 12:21:32
California,AB 2545,Report: labor force impact: artificial intelligence.,Introduced,Employment,2026,20252026,2026-05-21T08:41:54.355382+00:00,,2026-05-21 12:21:32
California,AB 2575,Health care services: artificial intelligence.,Introduced,Healthcare,2026,20252026,2026-05-21T08:54:47.201034+00:00,,2026-05-21 12:21:32
California,AB 2656,Public employees: notice: artificial intelligence performing service within scope of work.,Introduced,Employment; Government Use,2026,20252026,2026-05-21T09:09:52.735612+00:00,,2026-05-21 12:21:32
California,SB 1000,California AI Transparency Act.,Introduced,Transparency,2026,20252026,2026-05-21T08:52:44.401557+00:00,,2026-05-21 12:21:32
California,SB 1011,"Energy: Utility Infrastructure AI Safety, Oversight, and Workforce Protection Act.",Introduced,Safety/Liability,2026,20252026,2026-05-21T09:25:43.340211+00:00,,2026-05-21 12:21:32
California,SB 1119,Companion chatbots: children's safety.,Introduced,Chatbots; Education/Child Protection; Safety/Liability,2026,20252026,2026-05-21T08:45:12.050201+00:00,,2026-05-21 12:21:32
California,SB 867,Toys: companion chatbots.,Introduced,Chatbots,2026,20252026,2026-05-19T09:01:23.302548+00:00,,2026-05-21 12:21:32
California,SB 903,Mental health professionals: artificial intelligence.,Introduced,Healthcare,2026,20252026,2026-05-21T09:06:24.870180+00:00,,2026-05-21 12:21:32
California,SB 947,Employment: automated decision systems.,Introduced,Employment,2026,20252026,2026-05-21T09:00:03.137690+00:00,,2026-05-21 12:21:32
Colorado,HB 1139,Use of Artificial Intelligence in Health Care,Introduced,Healthcare,2026,2026A,2026-05-13T02:11:34.689871+00:00,,2026-05-21 12:21:32
Connecticut,HB 5342,AN ACT CONCERNING THE USE OF ARTIFICIAL INTELLIGENCE AND OTHER MEANS TO GENERATE DECEPTIVE SYNTHETIC MEDIA AND AFFECT ELECTIONS.,Introduced,Elections,2026,2026,2026-05-05T01:31:40.426820+00:00,,2026-05-21 12:21:32
Florida,HB 1395,Artificial Intelligence,Introduced,General AI,2026,2026,2026-03-18T19:34:00.096660+00:00,,2026-05-21 12:21:32
Florida,SB 2D,Artificial Intelligence Bill of Rights,Introduced,General AI,2026,2026D,2026-05-01T00:19:42.965933+00:00,,2026-05-21 12:21:32
Georgia,SB 540,Online Internet Safety; certain disclosures related to conversational AI services; require,Introduced,Transparency; Chatbots; Safety/Liability,2026,2025_26,2026-05-16T16:24:58.223021+00:00,,2026-05-21 12:21:32
Illinois,HB 4804,REGISTERED NURSE USE OF AI,Introduced,General AI,2026,104th,2026-03-28T08:48:23.192378+00:00,,2026-05-21 12:21:32
Illinois,HB 4980,HUMAN CONTROL OF AI ACT,Introduced,General AI,2026,104th,2026-04-18T15:11:43.792768+00:00,,2026-05-21 12:21:32
Illinois,SB 2909,SCH CD-TEACHER EVALUATION-AI,Introduced,General AI,2026,104th,2026-05-21T04:17:48.749539+00:00,,2026-05-21 12:21:32
Illinois,SB 3261,ARTIFICIAL INTELLIGENCE SAFETY,Introduced,Safety/Liability,2026,104th,2026-05-15T21:37:28.008831+00:00,,2026-05-21 12:21:32
Illinois,SB 3368,CHATBOT RESPONSE LIABILITY ACT,Introduced,Chatbots; Safety/Liability,2026,104th,2026-05-15T22:02:23.133793+00:00,,2026-05-21 12:21:32
Illinois,SB 3702,REGISTERED NURSE USE OF AI,Introduced,General AI,2026,104th,2026-05-15T21:39:53.665571+00:00,,2026-05-21 12:21:32
Kentucky,HB 201,AN ACT relating to the use of algorithmic devices in setting the amount of rent to be charged to a residential tenant.,Introduced,General AI,2026,2026RS,2026-05-21T01:18:23.706952+00:00,,2026-05-21 12:21:32
Kentucky,HB 641,AN ACT relating to mental health chatbots.,Introduced,Healthcare; Chatbots,2026,2026RS,2026-05-21T01:09:22.196371+00:00,,2026-05-21 12:21:32
Louisiana,HB 119,CRIME: Provides relative to unlawful conduct involving images of another person created by artificial intelligence (REF SEE FISC NOTE GF EX),Introduced,General AI,2026,2026,2026-05-21T01:18:02.929456+00:00,,2026-05-21 12:21:32
Louisiana,HB 734,COMMERCE: Creates a consumer bill of rights regarding artificial intelligence,Introduced,General AI,2026,2026,2026-04-02T16:57:13.547023+00:00,,2026-05-21 12:21:32
Louisiana,HB 872,FISHING/COMMERCIAL: Requires all commercial menhaden reduction fishery vessels to use an AIS system,Introduced,General AI,2026,2026,2026-05-21T01:23:20.347409+00:00,,2026-05-21 12:21:32
Louisiana,HR 249,STUDENT/STANDARDS: Requests the State Board of Elementary and Secondary Education to incorporate artificial intelligence into content standards,Introduced,Education/Child Protection,2026,2026,2026-05-20T20:32:56.261685+00:00,,2026-05-21 12:21:32
Louisiana,SB 110,CRIME/PUNISHMENT: Prohibits using a child's image to train artificial intelligence to produce child sexual abuse materials. (8/1/26),Introduced,Education/Child Protection,2026,2026,2026-05-21T06:36:03.985259+00:00,,2026-05-21 12:21:32
Louisiana,SB 346,SCHOOLS: Prohibits the use of deepfake material against students enrolled in K-12. (8/1/26),Introduced,Elections; Education/Child Protection,2026,2026,2026-05-21T01:36:30.068432+00:00,,2026-05-21 12:21:32
Louisiana,SB 347,"COLLEGES/UNIVERSITIES: Provides for the crime of ""unlawful deepfake"" to be added to the definition of power-based violence under the Campus Accountability and Safety Act. (gov sig)",Introduced,Elections; Safety/Liability,2026,2026,2026-05-21T06:37:13.492477+00:00,,2026-05-21 12:21:32
Maryland,HB 145,"Election Law - Election Misinformation, Election Disinformation, and Deepfakes",Introduced,Elections,2026,2026,2026-04-14T19:54:31.054325+00:00,,2026-05-21 12:21:32
Maryland,SB 141,"Election Law - Election Misinformation, Election Disinformation, and Deepfakes",Introduced,Elections,2026,2026,2026-05-19T15:52:33.357283+00:00,,2026-05-21 12:21:32
Maryland,SB 8,Criminal Law - Identity Fraud - Artificial Intelligence and Deepfake Representations,Introduced,Elections; Criminal Justice,2026,2026,2026-05-19T15:46:37.767258+00:00,,2026-05-21 12:21:32
Michigan,HB 5899,State management: other; artificial intelligence pilot program; establish for state departments and agencies. Creates new act.,Introduced,General AI,2026,2025-2026,2026-05-20T22:30:28.471441+00:00,,2026-05-21 12:21:32
Michigan,SB 991,Trade: consumer goods and services; use of certain algorithms and protected class data to set prices; prohibit. Amends sec. 3 of 1976 PA 331 (MCL 445.903) & adds sec. 3j.,Introduced,General AI,2026,2025-2026,2026-05-20T22:19:09.678269+00:00,,2026-05-21 12:21:32
New Mexico,HB 22,DISTRIBUTION OF SENSITIVE AND DEEPFAKE IMAGES,Introduced,Elections,2026,2026,2026-03-26T18:06:42.616699+00:00,,2026-05-21 12:21:32
New York,A 10379,Prohibits artificial intelligence chatbots from using features which are considered unsafe for minors,Introduced,Chatbots; Education/Child Protection,2026,2025-2026,2026-05-19T02:34:04.487301+00:00,,2026-05-21 12:21:32
New York,A 11048,Relates to the use of artificial intelligence for utilization review,Introduced,General AI,2026,2025-2026,2026-05-09T00:24:20.347985+00:00,,2026-05-21 12:21:32
New York,A 11144,Relates to a prohibition on chatbot toys,Introduced,Chatbots,2026,2025-2026,2026-05-21T02:57:36.590585+00:00,,2026-05-21 12:21:32
New York,A 9581,Requires covered businesses to annually report to the department of labor regarding the impact of artificial intelligence on hiring and the nature of artificial intelligence use,Introduced,Employment,2026,2025-2026,2026-05-21T02:27:09.907980+00:00,,2026-05-21 12:21:32
New York,S 10241,Relates to the use of artificial intelligence for utilization review,Introduced,General AI,2026,2025-2026,2026-05-09T00:07:45.060920+00:00,,2026-05-21 12:21:32
New York,S 9051,Prohibits artificial intelligence chatbots from using features which are considered unsafe for minors,Introduced,Chatbots; Education/Child Protection,2026,2025-2026,2026-05-20T02:53:28.363363+00:00,,2026-05-21 12:21:32
New York,S 9408,Relates to a prohibition on chatbot toys,Introduced,Chatbots,2026,2025-2026,2026-05-15T06:34:28.349960+00:00,,2026-05-21 12:21:32
North Carolina,HB 1161,Omnibus Artificial Intelligence Protections.,Introduced,General AI,2026,2025,2026-05-05T20:55:28.612796+00:00,,2026-05-21 12:21:32
Oklahoma,HB 3545,Technology; artificial intelligence; state agencies; prohibited uses; permitted uses; Office of Management and Enterprise Services; effective date.,Introduced,General AI,2026,2026,2026-04-01T23:50:50.407218+00:00,,2026-05-21 12:21:32
Rhode Island,HB 7767,AN ACT RELATING TO LABOR AND LABOR RELATIONS -- ARTIFICIAL INTELLIGENCE USE AND FAIR EMPLOYMENT PRACTICES,Introduced,Employment,2026,2026,2026-04-16T14:53:18.514163+00:00,,2026-05-21 12:21:32
Rhode Island,SB 2499,AN ACT RELATING TO LABOR AND LABOR RELATIONS -- ARTIFICIAL INTELLIGENCE USE AND FAIR EMPLOYMENT PRACTICES,Introduced,Employment,2026,2026,2026-04-09T14:58:24.105579+00:00,,2026-05-21 12:21:32
South Carolina,H 5476,Protecting Children from Chatbots,Introduced,Chatbots; Education/Child Protection,2026,2025-2026,2026-04-01T07:24:51.921558+00:00,,2026-05-21 12:21:32
Tennessee,HB 1513,"Election Laws - As enacted, requires political advertisements to include a disclaimer if the advertisements include deepfake elements impersonating or depicting a candidate engaging in activity or speech in which the impersonated or depicted candidate did not in fact engage; makes a violation of such disclaimer requirement a Class C misdemeanor; entitles candidate to damages and equitable relief for violations. - Amends TCA Title 2, Chapter 19.",Introduced,Elections,2026,114,2026-04-01T03:05:36.044448+00:00,,2026-05-21 12:21:32
Tennessee,SB 1624,"Election Laws - As enacted, requires political advertisements to include a disclaimer if the advertisements include deepfake elements impersonating or depicting a candidate engaging in activity or speech in which the impersonated or depicted candidate did not in fact engage; makes a violation of such disclaimer requirement a Class C misdemeanor; entitles candidate to damages and equitable relief for violations. - Amends TCA Title 2, Chapter 19.",Introduced,Elections,2026,114,2026-04-21T08:08:43.101532+00:00,,2026-05-21 12:21:32
Tennessee,SB 2321,"Criminal Offenses - As introduced, prohibits a person or entity from distributing an electoral deepfake within 90 days of an election that the person or entity knows or should have known is a deceptive and fraudulent depiction of a candidate or political party; creates civil penalties and outlines exceptions. - Amends TCA Title 2 and Title 39, Chapter 17.",Introduced,Elections; Criminal Justice,2026,114,2026-04-21T09:02:56.750206+00:00,,2026-05-21 12:21:32
Vermont,H 816,An act relating to regulating the use of artificial intelligence in the provision of mental health services,Introduced,Healthcare,2026,2025-2026,2026-05-21T09:12:37.513631+00:00,,2026-05-21 12:21:32
Washington,HB 2225,Concerning regulation of artificial intelligence companion chatbots.,Introduced,Chatbots,2026,2025-2026,2026-04-17T14:24:53.070055+00:00,,2026-05-21 12:21:32
Washington,SB 5984,Concerning regulation of artificial intelligence companion chatbots.,Introduced,Chatbots,2026,2025-2026,2026-03-28T02:22:26.840346+00:00,,2026-05-21 12:21:32
Florida,SB 482,Artificial Intelligence Bill of Rights,Introduced,General AI,2025,2026,2026-03-20T23:11:12.501911+00:00,,2026-05-21 12:21:32
Illinois,HB 4248,ALGORITHMIC PRICE TRANSPARENCY,Introduced,Transparency,2025,104th,2026-05-21T03:59:04.602383+00:00,,2026-05-21 12:21:32
Minnesota,HF 1991,"Persons prohibited from allowing minors to access chatbots for recreational purposes, and civil penalties provided.",Introduced,Chatbots; Education/Child Protection,2025,2025-2026,2026-05-14T15:56:42.679468+00:00,,2026-05-21 12:21:32
Missouri,HB 1742,Establishes provisions relating to companion chatbots,Introduced,Chatbots,2025,2026,2026-05-16T02:04:09.379221+00:00,,2026-05-21 12:21:32
Nebraska,LB 615,Prohibit distributing deepfakes under the Nebraska Political Accountability and Disclosure Act,Introduced,Elections; Transparency,2025,109,2026-05-07T03:59:36.833668+00:00,,2026-05-21 12:21:32
New York,A 6545,Imposes liability for damages caused by a chatbot impersonating certain licensed professionals,Introduced,Chatbots; Safety/Liability,2025,2025-2026,2026-05-15T05:47:31.908942+00:00,,2026-05-21 12:21:32
New York,A 7172,Relation to the regulation of the use of artificial intelligence and facial recognition technology in criminal investigations,Introduced,Criminal Justice,2025,2025-2026,2026-05-14T07:26:40.411298+00:00,,2026-05-21 12:21:32
New York,A 8884,Relates to the development and use of certain artificial intelligence systems,Introduced,General AI,2025,2025-2026,2026-04-21T22:13:47.861973+00:00,,2026-05-21 12:21:32
New York,A 8962,Enacts the New York fundamental artificial intelligence requirements in (FAIR) news act,Introduced,General AI,2025,2025-2026,2026-05-15T07:04:06.944165+00:00,,2026-05-21 12:21:32
New York,S 8451,Enacts the New York fundamental artificial intelligence requirements in (FAIR) news act,Introduced,General AI,2025,2025-2026,2026-05-13T18:47:45.389307+00:00,,2026-05-21 12:21:32
Ohio,SB 163,"Regards AI images, simulated child porn, replica identity fraud",Introduced,Education/Child Protection,2025,136,2026-05-21T00:56:19.215069+00:00,,2026-05-21 12:21:32
Pennsylvania,HB 1396,"An Act amending the act of June 3, 1937 (P.L.1333, No.320), known as the Pennsylvania Election Code, in preliminary provisions, further providing for definitions; in district election officers, further providing for compensation of district election officers; in election districts and polling places, providing for ballot drop boxes; in electronic voting systems, further providing for definitions and for supplies, preparation of the voting system and of polling places, providing for pre-election logic and accuracy testing, repealing provisions relating to statistical sample and providing for post-election ballot audit; providing for electronic poll books and for electronic poll books and election infrastructure equipment bonds; in preparation for and conduct of primaries and elections, further providing for manner of applying to vote, persons entitled to vote, voter's certificates, entries to be made in district register, numbered lists of voters and challenges and for deadline for receipt of valid voter registration application; providing for in-person early voting; in voting by qualified absentee electors, further providing for date of application for absentee ballot, for approval of application for absentee ballot, for envelopes for official absentee ballots and for voting by absentee electors; in voting by qualified mail-in electors, further providing for applications for official mail-in ballots, for date of application for mail-in ballot, for approval of application for mail-in ballot, for envelopes for official mail-in ballots and for voting by mail-in electors; in returns of primaries and elections, further providing for computation of returns by county board, certification and issuance of certificates of election; in Election Integrity Grant Program, further providing for funding for elections; in recounts and contests, further providing for opening ballot boxes upon petition of electors alleging fraud or error and deposit or bond, for recanvassing voting machines upon petition of electors alleging fraud or error and for correction of returns, decision not to be final and evidence for prosecution; in penalties, further providing for interference with primaries and elections, frauds and conspiracy; making an appropriation; and making an editorial change.
 Amending Title 25 (Elections) of the Pennsylvania Consolidated Statutes, in registration system, further providing for SURE system; in voter registration, further providing for methods of voter registration, for application with driver's license application and for government agencies and for approval of registration applications; and, in changes in records, repealing provisions relating to removal notices, to transfer of registration and to change of enrollment of political party and further providing for death of registrant.",Introduced,Elections; Transparency; Government Use,2025,2025-2026,2026-05-21T01:43:31.683570+00:00,,2026-05-21 12:21:32
