State,Bill_ID,Title,Status,Category,Year,Session,Updated,URL,Last_Checked
California,AB 1609,Customer service chatbots.,Introduced,Chatbots,2026,20252026,2026-04-23T08:43:59.497924+00:00,,2026-04-30 10:59:27
California,AB 1898,Workplace artificial intelligence tools.,Introduced,Employment,2026,20252026,2026-04-30T09:09:49.410455+00:00,,2026-04-30 10:59:27
California,AB 1988,Companion chatbots: crisis interruption pauses.,Introduced,Chatbots,2026,20252026,2026-04-23T09:00:58.516289+00:00,,2026-04-30 10:59:27
California,AB 2023,Companion chatbots: children's safety.,Introduced,Chatbots; Education/Child Protection; Safety/Liability,2026,20252026,2026-04-29T09:10:00.112713+00:00,,2026-04-30 10:59:27
California,SB 1000,California AI Transparency Act.,Introduced,Transparency,2026,20252026,2026-04-28T09:05:34.837756+00:00,,2026-04-30 10:59:27
California,SB 1119,Companion chatbots: children's safety.,Introduced,Chatbots; Education/Child Protection; Safety/Liability,2026,20252026,2026-04-29T08:46:19.517006+00:00,,2026-04-30 10:59:27
Colorado,HB 1139,Use of Artificial Intelligence in Health Care,Introduced,Healthcare,2026,2026A,2026-04-06T21:33:17.153188+00:00,,2026-04-30 10:59:27
Colorado,HB 1195,Psychotherapy Artificial Intelligence Restrictions,Introduced,General AI,2026,2026A,2026-04-30T01:58:43.337712+00:00,,2026-04-30 10:59:27
Connecticut,HB 5342,AN ACT CONCERNING THE USE OF ARTIFICIAL INTELLIGENCE AND OTHER MEANS TO GENERATE DECEPTIVE SYNTHETIC MEDIA AND AFFECT ELECTIONS.,Introduced,Elections,2026,2026,2026-04-29T01:24:09.685319+00:00,,2026-04-30 10:59:27
Florida,HB 1395,Artificial Intelligence,Introduced,General AI,2026,2026,2026-03-18T19:34:00.096660+00:00,,2026-04-30 10:59:27
Florida,SB 2D,Artificial Intelligence Bill of Rights,Introduced,General AI,2026,2026D,2026-04-29T00:19:31.474458+00:00,,2026-04-30 10:59:27
Idaho,H 945,ARTIFICIAL INTELLIGENCE MEDICAL SERVICES – Adds to existing law to establish provisions regarding artifical intelligence medical services.,Introduced,Healthcare,2026,2026,2026-03-26T00:41:32.749775+00:00,,2026-04-30 10:59:27
Illinois,HB 4804,REGISTERED NURSE USE OF AI,Introduced,General AI,2026,104th,2026-03-28T08:48:23.192378+00:00,,2026-04-30 10:59:27
Illinois,HB 4980,HUMAN CONTROL OF AI ACT,Introduced,General AI,2026,104th,2026-04-18T15:11:43.792768+00:00,,2026-04-30 10:59:27
Illinois,SB 2909,SCH CD-TEACHER EVALUATION-AI,Introduced,General AI,2026,104th,2026-04-29T23:12:51.271944+00:00,,2026-04-30 10:59:27
Illinois,SB 3261,ARTIFICIAL INTELLIGENCE SAFETY,Introduced,Safety/Liability,2026,104th,2026-04-24T21:47:29.317782+00:00,,2026-04-30 10:59:27
Illinois,SB 3368,CHATBOT RESPONSE LIABILITY ACT,Introduced,Chatbots; Safety/Liability,2026,104th,2026-04-24T21:18:16.809593+00:00,,2026-04-30 10:59:27
Illinois,SB 3502,AI PRODUCT LIABILITY ACT,Introduced,Safety/Liability,2026,104th,2026-04-29T07:34:27.624817+00:00,,2026-04-30 10:59:27
Illinois,SB 3702,REGISTERED NURSE USE OF AI,Introduced,General AI,2026,104th,2026-04-24T21:39:27.802941+00:00,,2026-04-30 10:59:27
Iowa,HSB 766,"A bill for an act relating to the licensure of artificial intelligence augmented and autonomous service providers, and including penalties.",Introduced,General AI,2026,2025-2026,2026-03-24T21:49:08.843399+00:00,,2026-04-30 10:59:27
Louisiana,HB 119,CRIME: Provides relative to unlawful conduct involving images of another person created by artificial intelligence (RE SEE FISC NOTE GF EX),Introduced,General AI,2026,2026,2026-04-28T00:37:34.008732+00:00,,2026-04-30 10:59:27
Louisiana,HB 734,COMMERCE: Creates a consumer bill of rights regarding artificial intelligence,Introduced,General AI,2026,2026,2026-04-02T16:57:13.547023+00:00,,2026-04-30 10:59:27
Louisiana,HB 872,FISHING/COMMERCIAL: Requires all commercial menhaden reduction fishery vessels to use an AIS system,Introduced,General AI,2026,2026,2026-04-29T21:35:34.556875+00:00,,2026-04-30 10:59:27
Louisiana,SB 110,CRIME/PUNISHMENT: Prohibits using a child's image to train artificial intelligence to produce child sexual abuse materials. (8/1/26),Introduced,Education/Child Protection,2026,2026,2026-04-30T01:44:31.900621+00:00,,2026-04-30 10:59:27
Louisiana,SB 346,SCHOOLS: Prohibits the use of deepfake material against students enrolled in K-12. (8/1/26),Introduced,Elections; Education/Child Protection,2026,2026,2026-04-28T04:22:54.181931+00:00,,2026-04-30 10:59:27
Louisiana,SB 347,"COLLEGES/UNIVERSITIES: Provides for the crime of ""unlawful deepfake"" to be added to the definition of power-based violence under the Campus Accountability and Safety Act. (gov sig)",Introduced,Elections; Safety/Liability,2026,2026,2026-04-29T21:37:30.519942+00:00,,2026-04-30 10:59:27
Louisiana,SB 42,CRIME/PUNISHMENT: Prohibits using artificial intelligence to create child sexual abuse materials. (8/1/26),Introduced,Education/Child Protection,2026,2026,2026-04-30T01:31:05.713146+00:00,,2026-04-30 10:59:27
Maine,LD 2162,An Act To Regulate And Prevent Children'S Access To Artificial Intelligence Chatbots With Human-Like Features And Social Artificial Intelligence Companions,Introduced,Chatbots; Education/Child Protection,2026,132,2026-04-23T07:24:11.387398+00:00,,2026-04-30 10:59:27
Maryland,HB 145,"Election Law - Election Misinformation, Election Disinformation, and Deepfakes",Introduced,Elections,2026,2026,2026-04-14T19:54:31.054325+00:00,,2026-04-30 10:59:27
Maryland,SB 141,"Election Law - Election Misinformation, Election Disinformation, and Deepfakes",Introduced,Elections,2026,2026,2026-04-20T15:42:10.665060+00:00,,2026-04-30 10:59:27
Maryland,SB 8,Criminal Law - Identity Fraud - Artificial Intelligence and Deepfake Representations,Introduced,Elections; Criminal Justice,2026,2026,2026-04-14T21:58:52.722936+00:00,,2026-04-30 10:59:27
Michigan,HB 5899,State management: other; artificial intelligence pilot program; establish for state departments and agencies. Creates new act.,Introduced,General AI,2026,2025-2026,2026-04-24T16:52:58.829308+00:00,,2026-04-30 10:59:27
Minnesota,SF 4997,Artificial intelligence chatbot technology requirements provision,Introduced,Chatbots,2026,2025-2026,2026-04-22T03:07:38.481333+00:00,,2026-04-30 10:59:27
New Mexico,HB 22,DISTRIBUTION OF SENSITIVE AND DEEPFAKE IMAGES,Introduced,Elections,2026,2026,2026-03-26T18:06:42.616699+00:00,,2026-04-30 10:59:27
New York,A 11048,Relates to the use of artificial intelligence for utilization review,Introduced,General AI,2026,2025-2026,2026-04-27T22:49:13.827726+00:00,,2026-04-30 10:59:27
New York,A 11144,Relates to a prohibition on chatbot toys,Introduced,Chatbots,2026,2025-2026,2026-04-24T17:40:12.944408+00:00,,2026-04-30 10:59:27
New York,A 9581,Requires covered businesses to annually report to the department of labor regarding the impact of artificial intelligence on hiring and the nature of artificial intelligence use,Introduced,Employment,2026,2025-2026,2026-04-30T01:12:01.299919+00:00,,2026-04-30 10:59:27
New York,S 9051,Prohibits artificial intelligence chatbots from using features which are considered unsafe for minors,Introduced,Chatbots; Education/Child Protection,2026,2025-2026,2026-04-30T03:23:13.392986+00:00,,2026-04-30 10:59:27
New York,S 9408,Relates to a prohibition on chatbot toys,Introduced,Chatbots,2026,2025-2026,2026-04-25T03:12:25.448867+00:00,,2026-04-30 10:59:27
North Carolina,SB 864,Safe and Responsible AI in Schools Act.,Introduced,Education/Child Protection,2026,2025,2026-04-29T20:58:15.437231+00:00,,2026-04-30 10:59:27
Ohio,SR 344,Honoring the Ridgewood High School AI for Youth team on winning the 2026 Ohio Presidential AI Challenge.,Introduced,Education/Child Protection,2026,136,2026-04-27T21:40:23.086011+00:00,,2026-04-30 10:59:27
Oklahoma,HB 3545,Technology; artificial intelligence; state agencies; prohibited uses; permitted uses; Office of Management and Enterprise Services; effective date.,Introduced,General AI,2026,2026,2026-04-01T23:50:50.407218+00:00,,2026-04-30 10:59:27
Oklahoma,SB 1521,Artificial intelligence; definitions; requiring operators make certain disclosure; preventative measures for minor account holders; prohibitions; enforcement authority to Attorney General; civil penalty. Effective date.,Introduced,Transparency; Education/Child Protection,2026,2026,2026-04-30T00:14:54.875502+00:00,,2026-04-30 10:59:27
Oregon,SB 1546,Relating to artificial intelligence companions.,Introduced,General AI,2026,2026R1,2026-04-29T14:53:36.658998+00:00,,2026-04-30 10:59:27
Pennsylvania,HB 2314,An Act providing for a public education campaign focused on educating the public about artificial intelligence and improving AI consumer literacy.,Introduced,Elections; Government Use; Education/Child Protection,2026,2025-2026,2026-04-30T02:00:15.740803+00:00,,2026-04-30 10:59:27
Pennsylvania,HR 425,A Resolution urging the United States Congress to suspend any and all efforts to pass Federal legislation that would impose a moratorium on state-level artificial intelligence regulation; recognizing the potential benefits along with the risks of misuse and systemic harm of artificial intelligence; acknowledging the importance of state regulation of such technologies; and reaffirming the Pennsylvania General Assembly's sovereign authority to legislate for the protection of Pennsylvanians.,Introduced,Safety/Liability,2026,2025-2026,2026-04-30T01:57:09.212558+00:00,,2026-04-30 10:59:27
Rhode Island,HB 7767,AN ACT RELATING TO LABOR AND LABOR RELATIONS -- ARTIFICIAL INTELLIGENCE USE AND FAIR EMPLOYMENT PRACTICES,Introduced,Employment,2026,2026,2026-04-16T14:53:18.514163+00:00,,2026-04-30 10:59:27
Rhode Island,SB 2499,AN ACT RELATING TO LABOR AND LABOR RELATIONS -- ARTIFICIAL INTELLIGENCE USE AND FAIR EMPLOYMENT PRACTICES,Introduced,Employment,2026,2026,2026-04-09T14:58:24.105579+00:00,,2026-04-30 10:59:27
South Carolina,H 5476,Protecting Children from Chatbots,Introduced,Chatbots; Education/Child Protection,2026,2025-2026,2026-04-01T07:24:51.921558+00:00,,2026-04-30 10:59:27
South Carolina,S 788,Artificial Intelligence and Therapy or Psychotherapy,Introduced,General AI,2026,2025-2026,2026-04-30T07:53:38.847916+00:00,,2026-04-30 10:59:27
Tennessee,HB 1513,"Election Laws - As enacted, requires political advertisements to include a disclaimer if the advertisements include deepfake elements impersonating or depicting a candidate engaging in activity or speech in which the impersonated or depicted candidate did not in fact engage; makes a violation of such disclaimer requirement a Class C misdemeanor; entitles candidate to damages and equitable relief for violations. - Amends TCA Title 2, Chapter 19.",Introduced,Elections,2026,114,2026-04-01T03:05:36.044448+00:00,,2026-04-30 10:59:27
Tennessee,HB 1946,"Consumer Protection - As introduced, enacts the ""Curbing Harmful AI Technology (CHAT) Act."" - Amends TCA Title 29; Title 37 and Title 47.",Introduced,Safety/Liability,2026,114,2026-04-22T00:47:23.195746+00:00,,2026-04-30 10:59:27
Tennessee,SB 1624,"Election Laws - As enacted, requires political advertisements to include a disclaimer if the advertisements include deepfake elements impersonating or depicting a candidate engaging in activity or speech in which the impersonated or depicted candidate did not in fact engage; makes a violation of such disclaimer requirement a Class C misdemeanor; entitles candidate to damages and equitable relief for violations. - Amends TCA Title 2, Chapter 19.",Introduced,Elections,2026,114,2026-04-21T08:08:43.101532+00:00,,2026-04-30 10:59:27
Tennessee,SB 1700,"Consumer Protection - As introduced, enacts the ""Curbing Harmful AI Technology (CHAT) Act."" - Amends TCA Title 29; Title 37 and Title 47.",Introduced,Safety/Liability,2026,114,2026-04-28T22:10:11.852472+00:00,,2026-04-30 10:59:27
Tennessee,SB 2321,"Criminal Offenses - As introduced, prohibits a person or entity from distributing an electoral deepfake within 90 days of an election that the person or entity knows or should have known is a deceptive and fraudulent depiction of a candidate or political party; creates civil penalties and outlines exceptions. - Amends TCA Title 2 and Title 39, Chapter 17.",Introduced,Elections; Criminal Justice,2026,114,2026-04-21T09:02:56.750206+00:00,,2026-04-30 10:59:27
Utah,HB 276,Artificial Intelligence Modifications,Introduced,General AI,2026,2026,2026-03-26T01:36:04.640871+00:00,,2026-04-30 10:59:27
Washington,HB 2225,Concerning regulation of artificial intelligence companion chatbots.,Introduced,Chatbots,2026,2025-2026,2026-04-17T14:24:53.070055+00:00,,2026-04-30 10:59:27
Washington,SB 5984,Concerning regulation of artificial intelligence companion chatbots.,Introduced,Chatbots,2026,2025-2026,2026-03-28T02:22:26.840346+00:00,,2026-04-30 10:59:27
Florida,SB 482,Artificial Intelligence Bill of Rights,Introduced,General AI,2025,2026,2026-03-20T23:11:12.501911+00:00,,2026-04-30 10:59:27
Michigan,SB 760,Trade: business regulation; availability of companion chatbots to minors; prohibit. Creates new act.,Introduced,Chatbots; Education/Child Protection,2025,2025-2026,2026-04-29T22:22:55.914871+00:00,,2026-04-30 10:59:27
Missouri,SB 1183,"SB 1183 - Under the act, a creator, as defined in the act, shall not, within 18 weeks of an election, distribute a synthetic media message that the creator knows or should have known is a deceptive and fraudulent deepfake, as defined in the act. These provisions shall not apply if the creator of the audio or visual media includes a certain disclosure statement, as described in the act.

	A candidate whose appearance, action, or speech is depicted through the use of a deceptive and fraudulent deepfake may seek injunctive or other equitable relief from the creator prohibiting the publication of such deceptive and fraudulent deepfake.

	A person in violation of provisions under the act may be subject to certain criminal and civil penalties, as described in the act.

	The act shall not apply to certain exceptions and media as described in the act.

	The act is similar to a provision in SCS/HCS/HBs 2628 & 2603 (2024).
JULIA SHEVELEVA",Introduced,Elections; Transparency; Government Use; Criminal Justice,2025,2026,2026-03-23T19:58:43.178633+00:00,,2026-04-30 10:59:27
New York,A 7172,Relation to the regulation of the use of artificial intelligence and facial recognition technology in criminal investigations,Introduced,Criminal Justice,2025,2025-2026,2026-04-14T00:01:13.019046+00:00,,2026-04-30 10:59:27
New York,A 8884,Relates to the development and use of certain artificial intelligence systems,Introduced,General AI,2025,2025-2026,2026-04-21T22:13:47.861973+00:00,,2026-04-30 10:59:27
New York,A 8962,Enacts the New York fundamental artificial intelligence requirements in (FAIR) news act,Introduced,General AI,2025,2025-2026,2026-04-29T04:03:03.232695+00:00,,2026-04-30 10:59:27
New York,S 5668,"Relates to liability for misleading, incorrect, contradictory or harmful information provided to a user by a chatbot",Introduced,Chatbots; Safety/Liability,2025,2025-2026,2026-03-18T11:26:52.855403+00:00,,2026-04-30 10:59:27
New York,S 8331,"Enacts the ""New York artificial intelligence transparency for journalism act""",Introduced,Transparency,2025,2025-2026,2026-03-18T11:30:10.881454+00:00,,2026-04-30 10:59:27
New York,S 8451,Enacts the New York fundamental artificial intelligence requirements in (FAIR) news act,Introduced,General AI,2025,2025-2026,2026-04-29T02:32:01.269483+00:00,,2026-04-30 10:59:27
New York,S 8623,Prohibits the use of algorithmically set prices and requires the disclosure of automated pricing systems,Introduced,Transparency,2025,2025-2026,2026-04-30T01:02:08.912786+00:00,,2026-04-30 10:59:27
North Carolina,HB 301,Social Media and AI Safety.,Introduced,Safety/Liability,2025,2025,2026-04-29T20:58:12.335468+00:00,,2026-04-30 10:59:27
Tennessee,HB 1455,"Criminal Offenses - As introduced, creates a Class A felony offense of knowingly training artificial intelligence to encourage the act of suicide or criminal homicide, or act in specific manners, including developing an emotional relationship with an individual or simulating a human being, including in appearance, voice, or other mannerisms. - Amends TCA Title 29; Title 33; Title 39 and Title 47.",Introduced,Criminal Justice,2025,114,2026-04-24T04:53:49.862925+00:00,,2026-04-30 10:59:27
Tennessee,SB 1493,"Criminal Offenses - As introduced, creates a Class A felony offense of knowingly training artificial intelligence to encourage the act of suicide or criminal homicide, or act in specific manners, including developing an emotional relationship with an individual or simulating a human being, including in appearance, voice, or other mannerisms. - Amends TCA Title 29; Title 33; Title 39 and Title 47.",Introduced,Criminal Justice,2025,114,2026-04-29T22:02:06.509375+00:00,,2026-04-30 10:59:27
Wisconsin,AB 142,"Relating to: algorithmic software for residential housing, and providing a penalty.",Introduced,General AI,2025,2025,2026-04-29T23:16:27.673232+00:00,,2026-04-30 10:59:27
